{
  "schema_version": "evidence-receipt.v1",
  "receipt_id": "qreceipt.final-truthful-topology-ledger-2026-08-21",
  "repository": "Quirk-Systems/.github",
  "status": "verified",
  "subject": {
    "base_commit": "6136fa5fa77116abfbc103c822d9d244a0e870b3",
    "commit": "593052bafaf6e5617891836fa768533f6b317478",
    "changed_paths": [
      ".quirk/manual-prs.json",
      ".quirk/schemas/manual-pr-ledger.schema.json",
      "docs/REPOSITORY_STRATEGY.md",
      "docs/governance/TRUTHFUL_TOPOLOGY_CUT_SPEC.md",
      "docs/superpowers/plans/2026-08-21-truthful-topology-cut.md",
      "scripts/validate_topology.py",
      "tests/test_topology_contracts.py"
    ]
  },
  "claims": [
    {
      "claim_id": "qclaim.final-truthful-topology-ledger",
      "claim_type": "evidence",
      "authority_effect": "none",
      "statement": "The final 2026-08-21 topology refresh records the 19-repository scope and all 30 open non-Dependabot pull requests observed after the three cross-repository implementation pull requests were opened, binds the updated ledger, schema, validator, tests, and policy projections to this subject, and grants no merge, close, admission, ruleset, runtime, deployment, or owner authority.",
      "evidence_paths": [
        ".quirk/manual-prs.json",
        ".quirk/schemas/manual-pr-ledger.schema.json",
        "docs/REPOSITORY_STRATEGY.md",
        "docs/governance/TRUTHFUL_TOPOLOGY_CUT_SPEC.md",
        "docs/superpowers/plans/2026-08-21-truthful-topology-cut.md",
        "scripts/validate_topology.py",
        "tests/test_topology_contracts.py"
      ]
    }
  ],
  "artifacts": [
    {
      "path": ".quirk/manual-prs.json",
      "state": "present",
      "git_blob": "19df00a5c081ba04cd42e39c8e360a3e0a35334d",
      "sha256": "sha256:198b30c1f77d1334f20185108b046f59c2b30b62898d4e93aca3335db17e8aee"
    },
    {
      "path": ".quirk/schemas/manual-pr-ledger.schema.json",
      "state": "present",
      "git_blob": "547b45518b92619d1606107c1e9dd3f6a8561ed3",
      "sha256": "sha256:1d9bd62811bdf2f70a265df28a40667d9b3e4f02995e83f4017ee9cb9f35aac5"
    },
    {
      "path": "docs/REPOSITORY_STRATEGY.md",
      "state": "present",
      "git_blob": "fd5391809bbf2a63a98111fd5b799b7aa7d62893",
      "sha256": "sha256:5205bf7f6dd4661c7e9604520ec382ecd3b6e37870994274e16a10e8fc404995"
    },
    {
      "path": "docs/governance/TRUTHFUL_TOPOLOGY_CUT_SPEC.md",
      "state": "present",
      "git_blob": "f5622000fd3930b8e82491f19a4ac54d409d97d7",
      "sha256": "sha256:b8a4e3fac94a4850c81bd2b6a9f29c5b05b70f8d67016f1b2a903ec780e0f9b2"
    },
    {
      "path": "docs/superpowers/plans/2026-08-21-truthful-topology-cut.md",
      "state": "present",
      "git_blob": "e3c38a3b598d15745c5422cb220d98fb8e894f16",
      "sha256": "sha256:d974fdff6f36f328de0deee64e792937c6efd37a99b121b8c0998eb22a8bb4db"
    },
    {
      "path": "scripts/validate_topology.py",
      "state": "present",
      "git_blob": "8847afb2dad9cef5c51996c4076984dc79c18cf4",
      "sha256": "sha256:ddce77e04222693d7cef149357825a7b2feeed3f7b5fdca4c35271acac74db2a"
    },
    {
      "path": "tests/test_topology_contracts.py",
      "state": "present",
      "git_blob": "f0dd1b80e1323dec3c26813ce610479ed53495e0",
      "sha256": "sha256:b94b86e8bd940c4ed67b7de2db7ec8758db3b9421234b442fa3c8230994ef878"
    }
  ],
  "verification": {
    "commands": [
      {
        "command": "GitHub connector search: org Quirk-Systems, is:pr is:open -author:app/dependabot, returned 30 results",
        "result": "pass",
        "exit_code": 0
      },
      {
        "command": "python -m unittest discover -s tests -p 'test_*.py' -v",
        "result": "pass",
        "exit_code": 0
      },
      {
        "command": "python scripts/validate_topology.py --inventory .quirk/repositories.json --pull-requests .quirk/manual-prs.json",
        "result": "pass",
        "exit_code": 0
      },
      {
        "command": "python scripts/validate_evidence_receipts.py --repository Quirk-Systems/.github --root . --receipts .quirk/evidence",
        "result": "pass",
        "exit_code": 0
      },
      {
        "command": "git diff --check 6136fa5fa77116abfbc103c822d9d244a0e870b3..593052bafaf6e5617891836fa768533f6b317478",
        "result": "pass",
        "exit_code": 0
      }
    ],
    "verified_at": "2026-08-21T06:57:49Z"
  },
  "authority": {
    "admission_effect": "none",
    "authority_ref": null
  },
  "correction": null,
  "receipt_sha256": "sha256:5ae7d5f90f99225b01fcf836e99fb9d3947e276946ea1be3e8fbff728cf5565c"
}
